{
  "schemaVersion": 1,
  "release": {
    "version": "1.0.0",
    "commit": "1111111111111111111111111111111111111111",
    "archivePath": "evals/fixtures/release-adoption/v1.bundle.json",
    "archiveSha256": "sha256:e4947e763e9497eb07b0c729a3fafea6a8c4791377a9d1107d36c62e3119bafb",
    "manifestSha256": "sha256:24a1538d91c51d8b829b2931f8b9430226874bda565c484d1b511301f452ba17"
  },
  "components": {
    "stackProfile": {
      "path": "evals/fixtures/stack-profiles/react-vite.json",
      "sha256": "sha256:9b458b4e6639dfffde1e41ac99bf8297c03672786ed8575e52cb0db66f87f6b5"
    },
    "skillDistribution": {
      "path": "evals/fixtures/skill-distribution/releases/v1/manifest.json",
      "sha256": "sha256:0c2261e25f29c25f682749b3a5d0780fb471c17906be386177ff103114b650f0"
    }
  },
  "selection": {
    "optionalSkills": ["frontend"],
    "adapters": ["codex"]
  },
  "desktop": {
    "artifactStatus": "UNSIGNED_DEVELOPMENT_ONLY",
    "signing": "NOT_RUN",
    "notarization": "NOT_RUN",
    "usability": "NOT_RUN"
  },
  "execution": {
    "network": "NOT_RUN",
    "telemetry": "DISABLED",
    "dependencyInstall": "NOT_RUN",
    "databaseMigration": "NOT_RUN",
    "providerWrite": "NOT_RUN",
    "productionDeploy": "NOT_RUN"
  }
}
